Rating,Review Title,Review
5 review-rating,Lightweight and Pre-shrunk,"Gildan's one of my most purchased blanks for my business. I liked this package of t-shirts however, they are very thin. That being said they are great for summer and work well with embroidery. They do not shrink significantly when washed. Great basic t-shirt."
4 review-rating,Gildan makes very good t-shirts - I just hoped these had pockets,I like the no-tags and the hardiness of these.
5 review-rating,Good shirts........,"Ordered these and jumped the gun thinking they were pocket Ts. I like pockets in my Ts, so I gave them to my son. He loves them!!"
4 review-rating,Buenos,"Se ven buenos pero parece que después de unas lavadas se van a estirar, luego actualizo la opinión."
4 review-rating,The polyester shirts do not breathe well,"Overall, I like these shirts. The tailoring is solid, they haven't fallen apart despite many commercial washings and the colors hold up well.

My main critique pertains to the polycot blended shirts. It is worth noting that despite the claims of moisture wicking, cool and dry, blah, blah, when you wear one of them on a hot summer day you will KNOW it. They do not breathe well and trap heat. Do a quick compare with 100 percent cotton and you will feel the difference.

For me, as a 3-season shirt the blends work just fine. I would stick to cotton or a performance tee during high Summer."
5 review-rating,Must have tees!,These are must have tee for young boys and men. So soft and well made. The colors are basics and can be matched with anything.
5 review-rating,Great t-shirts,They are very soft and fit well. The tag less feature makes them even better.
5 review-rating,Great,"Exactly like the photo , great material , soft , right size , definitely worth it"
5 review-rating,Best deal,"Bought these to tie dye. They are really comfy, well sized, and work perfect for my needs"
5 review-rating,T-Shirts,"Good shirts, fit was accurate and that's saying a lot with the mixture of dimensions used in China to represent one size in America."
5 review-rating,Exactly what I was looking for,"I really like cotton shirts rather than synthetic, as they are much softer, wick away sweat as opposed to synthetic shirts that trap the moisture, which makes these cotton shirts an excellent choice for the hot summer weather, and they feel great against my skin. The colors that I bought look real nice with just the right amount of weight that they maintain their shape even after washing them.
They do shrink somewhat, as noted by other reviews, so I thank them for that information, so I adjusted my purchase with their input in mind.
And the price is great, so all together they are exactly what I was looking for in a short sleeve summer T- shirt."
5 review-rating,Very Soft and Don’t Shrink,This is a good brand with quality shirts and good prices for the more you buy.
4 review-rating,I needed to read better...,"I really like a 60/40 poly cotton blend t-shirt and swear when I was buying these that it was the case. After closer inspection, only the ""heather"" shirts are 60/40 and the solids are 100%. Consequently, the heather shirts fit and feel great before and after the wash. The solids fit and feel great (not as good as the blend though) but the fit changed after the wash (shrinkage). This ones on me (literally) but wish they wouldn't mix fabrics for this type of thing."
4 review-rating,Gildens mens shirts,"Buy these all the time for my son. Well made, generously sized, wash well and last and last."
5 review-rating,T-Shirts (multi pack),"Outstanding value, washes well, breathable fabric ! My husband and I run a small camp wood business from home. These T- Shirts have become a go to for us for the last 3 seasons. Great product, we will purchase again."
4 review-rating,Nice shirts,These were purchased as a gift for a friend and they seemed to be nice and good quality
4 review-rating,"Very cheap and decent, but not without flaws.","They feel good. Not top-of-the-line soft, but not bad. Fit well. Look OK - from a distance.

I noticed some oddities at the seams on the shoulders when I took them from the package. After a couple washes, there's already some fraying. Again, nothing drastic, but not a great sign.

Just fine for around the house, working, etc."
5 review-rating,perfect,"Perfect fit, perfect colors, durable, simple, handsome, classy, laid back, everyday use shirts. Go get them."
4 review-rating,Light duty,Ok. Very basic. Not heavy-duty.
4 review-rating,Great value,Good undershirts. Great quality for the price
5 review-rating,Undershirt,Good undershirt. Gildan fits better than other popular name brands and it’s a better value.
